{
  "id": "req_01K3M7QW8ZC4YRXB2N6VD9FTHE",
  "state": "pending",
  "version": 1,
  "org_id": "org_01K0A2QW8ZC4YRXB2N6VD9FTHE",
  "waiter_ref": "run:0198f2a1",
  "urgency": "high",
  "urgency_state": "attention",
  "prompt": {
    "title": "Refund $2,400 to Acme Corp?",
    "body": "Invoice **INV-8821** was double-charged on 2026-07-28. Acme has asked for a full refund of the second charge.",
    "evidence": [
      {
        "kind": "link",
        "label": "Invoice INV-8821",
        "url": "https://billing.internal/inv/8821"
      },
      {
        "kind": "table",
        "label": "Both charges",
        "value": {
          "columns": [
            "date",
            "amount",
            "id"
          ],
          "rows": [
            [
              "2026-07-28",
              "$2,400",
              "ch_1A"
            ],
            [
              "2026-07-28",
              "$2,400",
              "ch_1B"
            ]
          ]
        }
      }
    ]
  },
  "requires": {
    "v": 1,
    "answer": {
      "fields": [
        {
          "name": "decision",
          "label": "Decision",
          "type": "choice",
          "required": true,
          "options": [
            {
              "id": "approve",
              "label": "Refund it"
            },
            {
              "id": "reject",
              "label": "Don't refund"
            }
          ]
        },
        {
          "name": "note",
          "label": "Add a note",
          "type": "text",
          "required": false,
          "max_len": 500
        }
      ]
    },
    "capabilities": [],
    "authority": {
      "min_role": "editor",
      "auth_strength": "session",
      "quorum": 1,
      "forbid_requester": true
    }
  },
  "mode": "advisory",
  "presentation_binding": "advisory",
  "liveness": "durable",
  "on_waiter_terminal": "keep",
  "ttl_policy": {
    "on_expiry": "expire_and_deny"
  },
  "routing": {
    "targets": [
      {
        "kind": "role",
        "value": "editor"
      }
    ],
    "ladder": [
      {
        "after": "PT0S",
        "channels": [
          "inapp",
          "push"
        ]
      },
      {
        "after": "PT5M",
        "channels": [
          "chat",
          "email"
        ]
      },
      {
        "after": "PT15M",
        "channels": [
          "voice"
        ],
        "to": {
          "kind": "rotation",
          "value": "oncall"
        }
      }
    ]
  },
  "created_at": "2026-07-30T14:02:11Z",
  "expires_at": "2026-07-30T18:02:11Z",
  "attempt_expires_at": null,
  "answered_at": null,
  "superseded_by": null,
  "cancel_reason": null,
  "surface_url": "https://handoff.example.com/requests/req_01K3M7QW8ZC4YRXB2N6VD9FTHE",
  "deliveries": [
    {
      "id": "dlv_01K3M7QW9A8ZC4YRXB2N6VD9FT",
      "request_id": "req_01K3M7QW8ZC4YRXB2N6VD9FTHE",
      "channel": "inapp",
      "target": {
        "kind": "role",
        "value": "editor"
      },
      "rung": 0,
      "state": "queued",
      "grade_reached": null,
      "max_grade": "acted",
      "can_authenticate_person": true,
      "attempts": [],
      "created_at": "2026-07-30T14:02:11Z",
      "updated_at": "2026-07-30T14:02:11Z"
    },
    {
      "id": "dlv_01K3M7QW9B8ZC4YRXB2N6VD9FT",
      "request_id": "req_01K3M7QW8ZC4YRXB2N6VD9FTHE",
      "channel": "push",
      "target": {
        "kind": "role",
        "value": "editor"
      },
      "rung": 0,
      "state": "queued",
      "grade_reached": null,
      "max_grade": "delivered",
      "can_authenticate_person": false,
      "attempts": [],
      "created_at": "2026-07-30T14:02:11Z",
      "updated_at": "2026-07-30T14:02:11Z"
    }
  ],
  "receipt": null,
  "authorization": null,
  "waiter": {
    "state": "armed",
    "liveness": "durable"
  },
  "metadata": {
    "hint": "approval",
    "run_id": "0198f2a1",
    "customer": "acme"
  }
}
